<?xml version="1.0" encoding="UTF-8"?>
<!-- A small library that satisfies library.xsd. -->
<library xmlns:xsi="http://www.w3.org/2001/XMLSchema-instance" xsi:noNamespaceSchemaLocation="library.xsd">
  <name>The reading room</name>
  <book isbn="978-0-14-118776-1" format="paperback">
    <title>Middlemarch</title>
    <author>George Eliot</author>
    <year>1871</year>
    <lent>false</lent>
  </book>
  <book isbn="978-0-19-953556-9" format="hardback">
    <title>The Moonstone</title>
    <author>Wilkie Collins</author>
    <year>1868</year>
    <signed/>
  </book>
</library>
